{
  "version": 1,
  "dt": 0.01,
  "description": "Nine board presentations in front of the static rig.",
  "steps": [
    {
      "type": "ptp_pose",
      "robot": "ur5e",
      "base_se3_tool": {
        "rotation": [
          0.0,
          -0.6080612578693159,
          0.7938901099512359,
          -0.0
        ],
        "translation": [
          0.45,
          -0.11034532362266083,
          0.3773947698664323
        ]
      },
      "speed_scale": 0.5
    },
    {
      "type": "capture"
    },
    {
      "type": "ptp_pose",
      "robot": "ur5e",
      "base_se3_tool": {
        "rotation": [
          0.0,
          -0.4454080856067301,
          0.8953276703398303,
          -0.0
        ],
        "translation": [
          0.45,
          -0.11202427632726406,
          0.37396776725447706
        ]
      },
      "speed_scale": 0.5
    },
    {
      "type": "capture"
    },
    {
      "type": "ptp_pose",
      "robot": "ur5e",
      "base_se3_tool": {
        "rotation": [
          0.12123600010666696,
          -0.6037594441616573,
          0.7724739208781266,
          -0.15511417545445905
        ],
        "translation": [
          0.4462539340658409,
          -0.11104833994186376,
          0.37758447268272516
        ]
      },
      "speed_scale": 0.5
    },
    {
      "type": "capture"
    },
    {
      "type": "ptp_pose",
      "robot": "ur5e",
      "base_se3_tool": {
        "rotation": [
          -1.7291354397734256e-17,
          0.7483708342450701,
          -0.6632805548569457,
          1.5325315491118524e-17
        ],
        "translation": [
          0.45,
          -0.11007240355646349,
          0.38120117811097326
        ]
      },
      "speed_scale": 0.5
    },
    {
      "type": "capture"
    },
    {
      "type": "ptp_pose",
      "robot": "ur5e",
      "base_se3_tool": {
        "rotation": [
          -0.12123600010666698,
          -0.6037594441616574,
          0.7724739208781265,
          0.15511417545445905
        ],
        "translation": [
          0.4537460659341591,
          -0.11104833994186376,
          0.37758447268272516
        ]
      },
      "speed_scale": 0.5
    },
    {
      "type": "capture"
    },
    {
      "type": "ptp_pose",
      "robot": "ur5e",
      "base_se3_tool": {
        "rotation": [
          0.10236521891997113,
          -0.45391564152636993,
          0.8634607397012475,
          -0.19472417242793677
        ],
        "translation": [
          0.44646446609406726,
          -0.1125598929389054,
          0.3743303609533366
        ]
      },
      "speed_scale": 0.5
    },
    {
      "type": "capture"
    },
    {
      "type": "ptp_pose",
      "robot": "ur5e",
      "base_se3_tool": {
        "rotation": [
          -0.13515936502944165,
          0.7345708614834733,
          -0.6539565173975542,
          0.12032650937149518
        ],
        "translation": [
          0.44646446609406726,
          -0.11071771704490814,
          0.3811572480899147
        ]
      },
      "speed_scale": 0.5
    },
    {
      "type": "capture"
    },
    {
      "type": "ptp_pose",
      "robot": "ur5e",
      "base_se3_tool": {
        "rotation": [
          0.13515936502944165,
          0.7345708614834734,
          -0.6539565173975541,
          -0.12032650937149514
        ],
        "translation": [
          0.45353553390593276,
          -0.11071771704490814,
          0.3811572480899147
        ]
      },
      "speed_scale": 0.5
    },
    {
      "type": "capture"
    },
    {
      "type": "ptp_pose",
      "robot": "ur5e",
      "base_se3_tool": {
        "rotation": [
          -0.10236521891997118,
          -0.45391564152637004,
          0.8634607397012475,
          0.19472417242793685
        ],
        "translation": [
          0.45353553390593276,
          -0.11255989293890539,
          0.3743303609533366
        ]
      },
      "speed_scale": 0.5
    },
    {
      "type": "capture"
    }
  ]
}