{
  "version": 1,
  "dt": 0.01,
  "description": "Both robots move in turn; captures between moves.",
  "steps": [
    {
      "type": "ptp_joints",
      "robot": "ur5e",
      "q": [0.5, -1.2, 1.2, -1.6, -1.57, 0.3],
      "speed_scale": 0.3
    },
    {
      "type": "ptp_joints",
      "robot": "irb",
      "q": [0.4, 0.3, -0.2, 0.2, 0.8, 0.5],
      "speed_scale": 0.3
    },
    {
      "type": "capture"
    },
    {
      "type": "ptp_joints",
      "robot": "ur5e",
      "q": [-0.5, -1.8, 1.4, -1.2, -1.57, -0.3],
      "speed_scale": 0.3
    },
    {
      "type": "ptp_joints",
      "robot": "irb",
      "q": [-0.4, 0.2, 0.1, -0.2, 0.6, -0.5],
      "speed_scale": 0.3
    },
    {
      "type": "capture"
    },
    {
      "type": "ptp_joints",
      "robot": "ur5e",
      "q": [0.0, -1.5707963267948966, 1.5707963267948966, -1.5707963267948966, -1.5707963267948966, 0.0],
      "speed_scale": 0.3
    },
    {
      "type": "ptp_joints",
      "robot": "irb",
      "q": [0.0, 0.0, 0.0, 0.0, 0.5, 0.0],
      "speed_scale": 0.3
    },
    {
      "type": "capture"
    }
  ]
}
