{
  "version": 1,
  "dt": 0.01,
  "description": "Hand-eye calibration: 20 viewpoints of the board at 0.45\u20130.55 m (tools/closed-loop/make_scenario.py).",
  "steps": [
    {
      "type": "ptp_pose",
      "robot": "ur5e",
      "base_se3_tool": {
        "rotation": [
          0.7517881338990042,
          -0.6287611993067994,
          -0.1366756433199171,
          0.1442002929886586
        ],
        "translation": [
          0.529148955485145,
          0.10727911056127301,
          0.4800125707012043
        ]
      },
      "speed_scale": 0.5
    },
    {
      "type": "capture"
    },
    {
      "type": "ptp_pose",
      "robot": "ur5e",
      "base_se3_tool": {
        "rotation": [
          -0.6090311560312719,
          0.7906646919099646,
          -0.019425108036354517,
          -0.05960755931850629
        ],
        "translation": [
          0.36787182228962184,
          0.1749627219320341,
          0.4997815264901271
        ]
      },
      "speed_scale": 0.5
    },
    {
      "type": "capture"
    },
    {
      "type": "ptp_pose",
      "robot": "ur5e",
      "base_se3_tool": {
        "rotation": [
          0.800107592482382,
          -0.5668526189097327,
          -0.1940869031650062,
          -0.02891751903330341
        ],
        "translation": [
          0.47620185766335105,
          -0.07085817443896246,
          0.4919406102763969
        ]
      },
      "speed_scale": 0.5
    },
    {
      "type": "capture"
    },
    {
      "type": "ptp_pose",
      "robot": "ur5e",
      "base_se3_tool": {
        "rotation": [
          0.8578968035346276,
          -0.47152011143264655,
          -0.07415319778140077,
          0.1902187221553273
        ],
        "translation": [
          0.5055461171068816,
          0.1883416852415909,
          0.525329753465835
        ]
      },
      "speed_scale": 0.5
    },
    {
      "type": "capture"
    },
    {
      "type": "ptp_pose",
      "robot": "ur5e",
      "base_se3_tool": {
        "rotation": [
          -0.6926627156625187,
          0.7206827987097717,
          0.021231683641649013,
          0.019592896279424767
        ],
        "translation": [
          0.31790563501899505,
          0.0725548670313843,
          0.5451173033550633
        ]
      },
      "speed_scale": 0.5
    },
    {
      "type": "capture"
    },
    {
      "type": "ptp_pose",
      "robot": "ur5e",
      "base_se3_tool": {
        "rotation": [
          -0.6316945681944552,
          0.7124012333019161,
          0.27344857305022824,
          -0.13664674602903504
        ],
        "translation": [
          0.634765538690184,
          -0.016105841478360656,
          0.516196482695856
        ]
      },
      "speed_scale": 0.5
    },
    {
      "type": "capture"
    },
    {
      "type": "ptp_pose",
      "robot": "ur5e",
      "base_se3_tool": {
        "rotation": [
          0.8377183484916214,
          -0.5189762136179217,
          -0.006215413930454802,
          0.16986178772445767
        ],
        "translation": [
          0.43131335805995935,
          0.21546097756814922,
          0.5751845269206575
        ]
      },
      "speed_scale": 0.5
    },
    {
      "type": "capture"
    },
    {
      "type": "ptp_pose",
      "robot": "ur5e",
      "base_se3_tool": {
        "rotation": [
          0.843971633502673,
          -0.529181477313356,
          -0.08264826495975867,
          -0.029122331816414816
        ],
        "translation": [
          0.3943520967411964,
          -0.005404726906413566,
          0.48559424336532614
        ]
      },
      "speed_scale": 0.5
    },
    {
      "type": "capture"
    },
    {
      "type": "ptp_pose",
      "robot": "ur5e",
      "base_se3_tool": {
        "rotation": [
          -0.5818340342168744,
          0.7530337411193472,
          0.16093644635248763,
          -0.2617418606149003
        ],
        "translation": [
          0.6408455749170389,
          0.15633309169603443,
          0.4599234101863442
        ]
      },
      "speed_scale": 0.5
    },
    {
      "type": "capture"
    },
    {
      "type": "ptp_pose",
      "robot": "ur5e",
      "base_se3_tool": {
        "rotation": [
          -0.7052909500775858,
          0.7065842594939701,
          0.00617310709607283,
          -0.05714238989397158
        ],
        "translation": [
          0.3709226231786464,
          0.13788113097876104,
          0.5253920081320579
        ]
      },
      "speed_scale": 0.5
    },
    {
      "type": "capture"
    },
    {
      "type": "ptp_pose",
      "robot": "ur5e",
      "base_se3_tool": {
        "rotation": [
          0.881500300440655,
          -0.43754415441528666,
          -0.17564166814402982,
          0.025735921814250846
        ],
        "translation": [
          0.5215786024469637,
          -0.019645343784843443,
          0.521680293085653
        ]
      },
      "speed_scale": 0.5
    },
    {
      "type": "capture"
    },
    {
      "type": "ptp_pose",
      "robot": "ur5e",
      "base_se3_tool": {
        "rotation": [
          0.7323793353067157,
          -0.6181769835725959,
          -0.007383411034085381,
          0.28534752747882963
        ],
        "translation": [
          0.5263665436613469,
          0.3175782236537669,
          0.5055009956939118
        ]
      },
      "speed_scale": 0.5
    },
    {
      "type": "capture"
    },
    {
      "type": "ptp_pose",
      "robot": "ur5e",
      "base_se3_tool": {
        "rotation": [
          -0.6100606324451161,
          0.7868502301812297,
          0.09092242881851169,
          0.020636180415799513
        ],
        "translation": [
          0.36006438097218935,
          0.030649530003856576,
          0.5689323889670579
        ]
      },
      "speed_scale": 0.5
    },
    {
      "type": "capture"
    },
    {
      "type": "ptp_pose",
      "robot": "ur5e",
      "base_se3_tool": {
        "rotation": [
          0.7593804863991377,
          -0.5893674201659668,
          -0.21824498036628207,
          0.1683937334583531
        ],
        "translation": [
          0.6357325297752663,
          0.07119830096699854,
          0.5505586523587581
        ]
      },
      "speed_scale": 0.5
    },
    {
      "type": "capture"
    },
    {
      "type": "ptp_pose",
      "robot": "ur5e",
      "base_se3_tool": {
        "rotation": [
          0.853737282646665,
          -0.4588015602619111,
          0.1251265990501941,
          0.21207808639851577
        ],
        "translation": [
          0.3359680797482595,
          0.2923838779277608,
          0.4568844654393007
        ]
      },
      "speed_scale": 0.5
    },
    {
      "type": "capture"
    },
    {
      "type": "ptp_pose",
      "robot": "ur5e",
      "base_se3_tool": {
        "rotation": [
          0.7133612538785551,
          -0.683141159423056,
          -0.15617295290853025,
          0.006624692201785421
        ],
        "translation": [
          0.44754966247477596,
          -0.010226722795756336,
          0.5059442789136294
        ]
      },
      "speed_scale": 0.5
    },
    {
      "type": "capture"
    },
    {
      "type": "ptp_pose",
      "robot": "ur5e",
      "base_se3_tool": {
        "rotation": [
          -0.5842033213125982,
          0.7690483809146921,
          0.0958406733250392,
          -0.2410096108382877
        ],
        "translation": [
          0.5905766912636963,
          0.19960896655212856,
          0.49642822405995335
        ]
      },
      "speed_scale": 0.5
    },
    {
      "type": "capture"
    },
    {
      "type": "ptp_pose",
      "robot": "ur5e",
      "base_se3_tool": {
        "rotation": [
          0.8300411957874166,
          -0.5453111497092203,
          0.11690642701809409,
          -0.0005006200822756171
        ],
        "translation": [
          0.2229610220762322,
          0.1273603034623384,
          0.5127921734701114
        ]
      },
      "speed_scale": 0.5
    },
    {
      "type": "capture"
    },
    {
      "type": "ptp_pose",
      "robot": "ur5e",
      "base_se3_tool": {
        "rotation": [
          0.852201051919089,
          -0.4850877668491375,
          -0.1775973193835138,
          0.08308079025325404
        ],
        "translation": [
          0.5489096826386012,
          0.028523610145146594,
          0.5462327482936175
        ]
      },
      "speed_scale": 0.5
    },
    {
      "type": "capture"
    },
    {
      "type": "ptp_pose",
      "robot": "ur5e",
      "base_se3_tool": {
        "rotation": [
          -0.6196744014986183,
          0.7614487484385082,
          -0.03569072722028373,
          -0.18688395227853524
        ],
        "translation": [
          0.45235773322509243,
          0.28846850802221347,
          0.5491776098221784
        ]
      },
      "speed_scale": 0.5
    },
    {
      "type": "capture"
    }
  ]
}
