{
  "version": 1,
  "dt": 0.01,
  "description": "Nine viewpoints around the board, then a 6 cm linear pass.",
  "steps": [
    {
      "type": "ptp_pose",
      "robot": "ur5e",
      "base_se3_tool": {
        "rotation": [
          0.8112421851755609,
          -0.584710284663765,
          0.0,
          -0.0
        ],
        "translation": [
          0.45,
          0.15,
          0.44999999999999996
        ]
      },
      "speed_scale": 0.5
    },
    {
      "type": "capture"
    },
    {
      "type": "ptp_pose",
      "robot": "ur5e",
      "base_se3_tool": {
        "rotation": [
          0.8029904014196654,
          -0.5646223007562476,
          -0.15608552246257526,
          0.10975145736704932
        ],
        "translation": [
          0.6185729670371605,
          0.15,
          0.41723273455505433
        ]
      },
      "speed_scale": 0.5
    },
    {
      "type": "capture"
    },
    {
      "type": "ptp_pose",
      "robot": "ur5e",
      "base_se3_tool": {
        "rotation": [
          0.7899752437118778,
          -0.5826929222204034,
          0.11326403035356257,
          0.1535556320838593
        ],
        "translation": [
          0.45,
          0.3185729670371604,
          0.41723273455505433
        ]
      },
      "speed_scale": 0.5
    },
    {
      "type": "capture"
    },
    {
      "type": "ptp_pose",
      "robot": "ur5e",
      "base_se3_tool": {
        "rotation": [
          0.8029904014196654,
          -0.5646223007562476,
          0.15608552246257523,
          -0.10975145736704925
        ],
        "translation": [
          0.2814270329628396,
          0.15000000000000002,
          0.41723273455505433
        ]
      },
      "speed_scale": 0.5
    },
    {
      "type": "capture"
    },
    {
      "type": "ptp_pose",
      "robot": "ur5e",
      "base_se3_tool": {
        "rotation": [
          0.7899752437118778,
          -0.5826929222204034,
          -0.1132640303535625,
          -0.15355563208385933
        ],
        "translation": [
          0.44999999999999996,
          -0.018572967037160402,
          0.41723273455505433
        ]
      },
      "speed_scale": 0.5
    },
    {
      "type": "capture"
    },
    {
      "type": "ptp_pose",
      "robot": "ur5e",
      "base_se3_tool": {
        "rotation": [
          0.7599407345093795,
          -0.5886545065754258,
          -0.0347299282165526,
          0.2734406407391925
        ],
        "translation": [
          0.6186192773493083,
          0.3186192773493082,
          0.38162164327039166
        ]
      },
      "speed_scale": 0.5
    },
    {
      "type": "capture"
    },
    {
      "type": "ptp_pose",
      "robot": "ur5e",
      "base_se3_tool": {
        "rotation": [
          0.7970247197525063,
          -0.5373784924814649,
          0.2705630705504978,
          0.05264576693404101
        ],
        "translation": [
          0.28138072265069175,
          0.3186192773493082,
          0.38162164327039166
        ]
      },
      "speed_scale": 0.5
    },
    {
      "type": "capture"
    },
    {
      "type": "ptp_pose",
      "robot": "ur5e",
      "base_se3_tool": {
        "rotation": [
          0.7599407345093795,
          -0.5886545065754258,
          0.0347299282165526,
          -0.2734406407391925
        ],
        "translation": [
          0.28138072265069175,
          -0.01861927734930825,
          0.38162164327039166
        ]
      },
      "speed_scale": 0.5
    },
    {
      "type": "capture"
    },
    {
      "type": "ptp_pose",
      "robot": "ur5e",
      "base_se3_tool": {
        "rotation": [
          0.7970247197525063,
          -0.5373784924814649,
          -0.27056307055049783,
          -0.05264576693404109
        ],
        "translation": [
          0.6186192773493083,
          -0.018619277349308308,
          0.38162164327039166
        ]
      },
      "speed_scale": 0.5
    },
    {
      "type": "capture"
    },
    {
      "type": "lin",
      "robot": "ur5e",
      "base_se3_tool": {
        "rotation": [
          0.7970247197525063,
          -0.5373784924814649,
          -0.27056307055049783,
          -0.05264576693404109
        ],
        "translation": [
          0.6186192773493083,
          -0.0786192773493083,
          0.38162164327039166
        ]
      },
      "speed_scale": 0.3
    },
    {
      "type": "capture",
      "id": "after_lin"
    }
  ]
}